{
  "schemaVersion": "1.1.0",
  "foundryProfile": "deploy",
  "network": "anvil",
  "chainId": 31337,
  "release": "fixture-v1",
  "expectedExecutor": "0xf39fd6e51aad88f6f4ce6ab8827279cfffb92266",
  "onFailure": "halt",
  "resume": "re-verify all prior predicates before continuing",
  "transactions": [
    {
      "id": "deploy-token",
      "kind": "deploy",
      "description": "Deploy the fixture token contract.",
      "artifactName": "MockERC20",
      "initCode": "0x60e060405234801561000f575f80fd5b50604051611dd2380380611dd283398181016040528101906100319190610266565b81816012828282825f908161004691906104e9565b50816001908161005691906104e9565b508060ff1660808160ff16815250504660a0818152505061007b61008f60201b60201c565b60c081815250505050505050505050610721565b5f7f8b73c3c69bb8fe3d512ecc4cf759cc79239f7b179b0ffacaa9a75d522b39400f5f6040516100bf9190610654565b60405180910390207fc89efdaa54c0f20c7adf612882df0950f5a951637e0307cdcb4c672f298b8bc646306040516020016100fe9594939291906106d0565b60405160208183030381529060405280519060200120905090565b5f604051905090565b5f80fd5b5f80fd5b5f80fd5b5f80fd5b5f601f19601f8301169050919050565b7f4e487b71000000000000000000000000000000000000000000000000000000005f52604160045260245ffd5b61017882610132565b810181811067ffffffffffffffff8211171561019757610196610142565b5b80604052505050565b5f6101a9610119565b90506101b5828261016f565b919050565b5f67ffffffffffffffff8211156101d4576101d3610142565b5b6101dd82610132565b9050602081019050919050565b8281835e5f83830152505050565b5f61020a610205846101ba565b6101a0565b9050828152602081018484840111156102265761022561012e565b5b6102318482856101ea565b509392505050565b5f82601f83011261024d5761024c61012a565b5b815161025d8482602086016101f8565b91505092915050565b5f806040838503121561027c5761027b610122565b5b5f83015167ffffffffffffffff81111561029957610298610126565b5b6102a585828601610239565b925050602083015167ffffffffffffffff8111156102c6576102c5610126565b5b6102d285828601610239565b9150509250929050565b5f81519050919050565b7f4e487b71000000000000000000000000000000000000000000000000000000005f52602260045260245ffd5b5f600282049050600182168061032a57607f821691505b60208210810361033d5761033c6102e6565b5b50919050565b5f819050815f5260205f209050919050565b5f6020601f8301049050919050565b5f82821b905092915050565b5f6008830261039f7fffffffffffffffffffffffffffffffffffffffffffffffffffffffffffffffff82610364565b6103a98683610364565b95508019841693508086168417925050509392505050565b5f819050919050565b5f819050919050565b5f6103ed6103e86103e3846103c1565b6103ca565b6103c1565b9050919050565b5f819050919050565b610406836103d3565b61041a610412826103f4565b848454610370565b825550505050565b5f90565b61042e610422565b6104398184846103fd565b505050565b5b8181101561045c576104515f82610426565b60018101905061043f565b5050565b601f8211156104a15761047281610343565b61047b84610355565b8101602085101561048a578190505b61049e61049685610355565b83018261043e565b50505b505050565b5f82821c905092915050565b5f6104c15f19846008026104a6565b1980831691505092915050565b5f6104d983836104b2565b9150826002028217905092915050565b6104f2826102dc565b67ffffffffffffffff81111561050b5761050a610142565b5b6105158254610313565b610520828285610460565b5f60209050601f831160018114610551575f841561053f578287015190505b61054985826104ce565b8655506105b0565b601f19841661055f86610343565b5f5b8281101561058657848901518255600182019150602085019450602081019050610561565b868310156105a3578489015161059f601f8916826104b2565b8355505b6001600288020188555050505b505050505050565b5f81905092915050565b5f819050815f5260205f209050919050565b5f81546105e081610313565b6105ea81866105b8565b9450600182165f811461060457600181146106195761064b565b60ff198316865281151582028601935061064b565b610622856105c2565b5f5b8381101561064357815481890152600182019150602081019050610624565b838801955050505b50505092915050565b5f61065f82846105d4565b915081905092915050565b5f819050919050565b61067c8161066a565b82525050565b61068b816103c1565b82525050565b5f73ffffffffffffffffffffffffffffffffffffffff82169050919050565b5f6106ba82610691565b9050919050565b6106ca816106b0565b82525050565b5f60a0820190506106e35f830188610673565b6106f06020830187610673565b6106fd6040830186610673565b61070a6060830185610682565b61071760808301846106c1565b9695505050505050565b60805160a05160c05161168761074b5f395f61074d01525f61071901525f6106f401526116875ff3fe608060405234801561000f575f80fd5b50600436106100fe575f3560e01c806370a0823111610095578063a9059cbb11610064578063a9059cbb146102ae578063d505accf146102de578063dd62ed3e146102fa578063de5f72fd1461032a576100fe565b806370a08231146102145780637ecebe001461024457806395d89b41146102745780639dc29fac14610292576100fe565b806328ccaa29116100d157806328ccaa291461019e578063313ce567146101bc5780633644e515146101da57806340c10f19146101f8576100fe565b806306fdde0314610102578063095ea7b31461012057806318160ddd1461015057806323b872dd1461016e575b5f80fd5b61010a610334565b6040516101179190610f03565b60405180910390f35b61013a60048036038101906101359190610fb4565b6103bf565b604051610147919061100c565b60405180910390f35b6101586104ac565b6040516101659190611034565b60405180910390f35b6101886004803603810190610183919061104d565b6104b2565b604051610195919061100c565b60405180910390f35b6101a66106ed565b6040516101b3919061100c565b60405180910390f35b6101c46106f2565b6040516101d191906110b8565b60405180910390f35b6101e2610716565b6040516101ef91906110e9565b60405180910390f35b610212600480360381019061020d9190610fb4565b610772565b005b61022e60048036038101906102299190611102565b610780565b60405161023b9190611034565b60405180910390f35b61025e60048036038101906102599190611102565b610795565b60405161026b9190611034565b60405180910390f35b61027c6107aa565b6040516102899190610f03565b60405180910390f35b6102ac60048036038101906102a79190610fb4565b610836565b005b6102c860048036038101906102c39190610fb4565b610844565b6040516102d5919061100c565b60405180910390f35b6102f860048036038101906102f39190611181565b610951565b005b610314600480360381019061030f919061121e565b610c3e565b6040516103219190611034565b60405180910390f35b610332610c5e565b005b5f805461034090611289565b80601f016020809104026020016040519081016040528092919081815260200182805461036c90611289565b80156103b75780601f1061038e576101008083540402835291602001916103b7565b820191905f5260205f20905b81548152906001019060200180831161039a57829003601f168201915b505050505081565b5f8160045f3373ffffffffffffffffffffffffffffffffffffffff1673ffffffffffffffffffffffffffffffffffffffff1681526020019081526020015f205f8573ffffffffffffffffffffffffffffffffffffffff1673ffffffffffffffffffffffffffffffffffffffff1681526020019081526020015f20819055508273ffffffffffffffffffffffffffffffffffffffff163373ffffffffffffffffffffffffffffffffffffffff167f8c5be1e5ebec7d5bd14f71427d1e84f3dd0314c0f7b2291e5b200ac8c7c3b9258460405161049a9190611034565b60405180910390a36001905092915050565b60025481565b5f8060045f8673ffffffffffffffffffffffffffffffffffffffff1673ffffffffffffffffffffffffffffffffffffffff1681526020019081526020015f205f3373ffffffffffffffffffffffffffffffffffffffff1673ffffffffffffffffffffffffffffffffffffffff1681526020019081526020015f205490507fffffffffffffffffffffffffffffffffffffffffffffffffffffffffffffffff81146105df57828161056291906112e6565b60045f8773ffffffffffffffffffffffffffffffffffffffff1673ffffffffffffffffffffffffffffffffffffffff1681526020019081526020015f205f3373ffffffffffffffffffffffffffffffffffffffff1673ffffffffffffffffffffffffffffffffffffffff1681526020019081526020015f20819055505b8260035f8773ffffffffffffffffffffffffffffffffffffffff1673ffffffffffffffffffffffffffffffffffffffff1681526020019081526020015f205f82825461062b91906112e6565b925050819055508260035f8673ffffffffffffffffffffffffffffffffffffffff1673ffffffffffffffffffffffffffffffffffffffff1681526020019081526020015f205f82825401925050819055508373ffffffffffffffffffffffffffffffffffffffff168573ffffffffffffffffffffffffffffffffffffffff167fddf252ad1be2c89b69c2b068fc378daa952ba7f163c4a11628f55a4df523b3ef856040516106d99190611034565b60405180910390a360019150509392505050565b600181565b7f000000000000000000000000000000000000000000000000000000000000000081565b5f7f0000000000000000000000000000000000000000000000000000000000000000461461074b57610746610c73565b61076d565b7f00000000000000000000000000000000000000000000000000000000000000005b905090565b61077c8282610cfd565b5050565b6003602052805f5260405f205f915090505481565b6005602052805f5260405f205f915090505481565b600180546107b790611289565b80601f01602080910402602001604051908101604052809291908181526020018280546107e390611289565b801561082e5780601f106108055761010080835404028352916020019161082e565b820191905f5260205f20905b81548152906001019060200180831161081157829003601f168201915b505050505081565b6108408282610dc8565b5050565b5f8160035f3373ffffffffffffffffffffffffffffffffffffffff1673ffffffffffffffffffffffffffffffffffffffff1681526020019081526020015f205f82825461089191906112e6565b925050819055508160035f8573ffffffffffffffffffffffffffffffffffffffff1673ffffffffffffffffffffffffffffffffffffffff1681526020019081526020015f205f82825401925050819055508273ffffffffffffffffffffffffffffffffffffffff163373ffffffffffffffffffffffffffffffffffffffff167fddf252ad1be2c89b69c2b068fc378daa952ba7f163c4a11628f55a4df523b3ef8460405161093f9190611034565b60405180910390a36001905092915050565b42841015610994576040517f08c379a000000000000000000000000000000000000000000000000000000000815260040161098b90611363565b60405180910390fd5b5f600161099f610716565b7f6e71edae12b1b97f4d1f60370fef10105fa2faae0126114a169c64845d6126c98a8a8a60055f8f73ffffffffffffffffffffffffffffffffffffffff1673ffffffffffffffffffffffffffffffffffffffff1681526020019081526020015f205f815480929190600101919050558b604051602001610a2496959493929190611390565b60405160208183030381529060405280519060200120604051602001610a4b929190611463565b604051602081830303815290604052805190602001208585856040515f8152602001604052604051610a809493929190611499565b6020604051602081039080840390855afa158015610aa0573d5f803e3d5ffd5b5050506020604051035190505f73ffffffffffffffffffffffffffffffffffffffff168173ffffffffffffffffffffffffffffffffffffffff1614158015610b1357508773ffffffffffffffffffffffffffffffffffffffff168173ffffffffffffffffffffffffffffffffffffffff16145b610b52576040517f08c379a0000000000000000000000000000000000000000000000000000000008152600401610b4990611526565b604051809